ID,Text,Comment
AdvancedZiplineStation.DisplayNameLocKey,Advanced Zipline Station,
AdvancedZiplineStation.DescriptionLocKey,An advanced zipline station supporting up to 3 connections and transferring mechanical power through cables.,
AdvancedZiplineStation.FlavorDescriptionLocKey,"Why run power lines when you can zip them?",
AdvancedZiplinePylon.DisplayNameLocKey,Advanced Zipline Pylon,
AdvancedZiplinePylon.DescriptionLocKey,An advanced zipline relay tower supporting up to 3 connections and transferring mechanical power through cables.,
AdvancedZiplinePylon.FlavorDescriptionLocKey,"Power on a pole.",
AdvancedZiplineBeam.DisplayNameLocKey,Advanced Zipline Beam,
AdvancedZiplineBeam.DescriptionLocKey,An advanced horizontal zipline relay supporting up to 3 connections and transferring mechanical power through cables.,
AdvancedZiplineBeam.FlavorDescriptionLocKey,"Bridging the power gap.",
